[
  {
    "flow_id": "DF-COMPANY-001",
    "category": "company_facts",
    "controller_role": "controller",
    "purpose": "Saudi company registration, industry, and size facts for B2B qualification",
    "lawful_basis": "legitimate_interest",
    "source": {
      "system": "internal",
      "method": "derived"
    },
    "fields": [
      "cr_number",
      "legal_name",
      "industry_code",
      "employee_band",
      "city"
    ],
    "recipients": [
      {
        "name": "Railway PostgreSQL",
        "role": "processor",
        "region": "us-west-1",
        "safeguards": "Tenant-scoped RLS; soft-delete honored"
      }
    ],
    "processors": {
      "railway_postgres": {
        "name": "Railway Inc.",
        "role_in_flow": "processor",
        "region": "us-west-1",
        "safeguards": "Postgres with row-level security, tenant_id enforced",
        "dpa_signed": true,
        "dpa_ref": "DPA-RAILWAY-REF"
      },
      "vercel_hosting": {
        "name": "Vercel Inc.",
        "role_in_flow": "processor",
        "region": "us-east-1",
        "safeguards": "Edge caching disabled for authenticated routes",
        "dpa_signed": true,
        "dpa_ref": "DPA-VERCEL-REF"
      },
      "llm_providers": [
        {
          "name": "OpenAI",
          "role_in_flow": "sub_processor",
          "region": "us-east-1",
          "safeguards": "Zero retention on API tier, no training on inputs",
          "dpa_signed": true,
          "dpa_ref": "DPA-OPENAI-REF"
        }
      ],
      "email_service": {
        "name": "Resend",
        "role_in_flow": "processor",
        "region": "us-east-1",
        "safeguards": "DKIM/SPF configured, unsubscribe enforced",
        "dpa_signed": true,
        "dpa_ref": "DPA-RESEND-REF"
      },
      "whatsapp_bsp": {
        "name": "Meta WhatsApp Business",
        "role_in_flow": "processor",
        "region": "multi-region",
        "safeguards": "WhatsApp Business Policy; no automation, opt-in only",
        "dpa_signed": false,
        "dpa_ref": "PENDING-META-DPA"
      },
      "calendar": {
        "name": "Google Calendar",
        "role_in_flow": "processor",
        "region": "global",
        "safeguards": "OAuth 2.0 scoped read/write",
        "dpa_signed": true,
        "dpa_ref": "DPA-GOOGLE-REF"
      },
      "analytics": {
        "name": "PostHog",
        "role_in_flow": "processor",
        "region": "eu-central-1",
        "safeguards": "IP anonymization enabled",
        "dpa_signed": true,
        "dpa_ref": "DPA-POSTHOG-REF"
      },
      "payment_provider": {
        "name": "Moyasar",
        "role_in_flow": "processor",
        "region": "sa-central-1",
        "safeguards": "PCI-DSS Level 1; CVV/PAN never stored",
        "dpa_signed": true,
        "dpa_ref": "DPA-MOYASAR-REF"
      }
    },
    "region": "us-west-1",
    "retention_days": 1825,
    "retention_trigger": "last_interaction",
    "deletion_method": "anonymize",
    "consent_capture": {
      "required": true,
      "method": "explicit_checkbox",
      "timestamp_field": "consent_timestamp",
      "evidence_ref": "consent_record_id"
    },
    "data_subject_path": {
      "access": "POST /api/v1/data-subject/access",
      "rectification": "POST /api/v1/data-subject/rectify",
      "deletion": "POST /api/v1/data-subject/delete",
      "portability": "GET /api/v1/data-subject/export"
    },
    "cross_border_transfer": {
      "occurs": true,
      "mechanism": "standard_contractual_clauses",
      "safeguards": "SCCs signed; counsel review pending",
      "counsel_review_ref": "PENDING-COUNSEL-REVIEW"
    },
    "review_status": "draft",
    "notes": "Tenant isolation via row-level security; approval-gated writes."
  },
  {
    "flow_id": "DF-CONTACT-001",
    "category": "business_contact_data",
    "controller_role": "controller",
    "purpose": "B2B contact details for opportunities and outreach",
    "lawful_basis": "legitimate_interest",
    "source": {
      "system": "internal",
      "method": "derived"
    },
    "fields": [
      "full_name",
      "work_email",
      "work_phone",
      "job_title",
      "company_id"
    ],
    "recipients": [
      {
        "name": "Railway PostgreSQL",
        "role": "processor",
        "region": "us-west-1",
        "safeguards": "Tenant-scoped RLS; soft-delete honored"
      }
    ],
    "processors": {
      "railway_postgres": {
        "name": "Railway Inc.",
        "role_in_flow": "processor",
        "region": "us-west-1",
        "safeguards": "Postgres with row-level security, tenant_id enforced",
        "dpa_signed": true,
        "dpa_ref": "DPA-RAILWAY-REF"
      },
      "vercel_hosting": {
        "name": "Vercel Inc.",
        "role_in_flow": "processor",
        "region": "us-east-1",
        "safeguards": "Edge caching disabled for authenticated routes",
        "dpa_signed": true,
        "dpa_ref": "DPA-VERCEL-REF"
      },
      "llm_providers": [
        {
          "name": "OpenAI",
          "role_in_flow": "sub_processor",
          "region": "us-east-1",
          "safeguards": "Zero retention on API tier, no training on inputs",
          "dpa_signed": true,
          "dpa_ref": "DPA-OPENAI-REF"
        }
      ],
      "email_service": {
        "name": "Resend",
        "role_in_flow": "processor",
        "region": "us-east-1",
        "safeguards": "DKIM/SPF configured, unsubscribe enforced",
        "dpa_signed": true,
        "dpa_ref": "DPA-RESEND-REF"
      },
      "whatsapp_bsp": {
        "name": "Meta WhatsApp Business",
        "role_in_flow": "processor",
        "region": "multi-region",
        "safeguards": "WhatsApp Business Policy; no automation, opt-in only",
        "dpa_signed": false,
        "dpa_ref": "PENDING-META-DPA"
      },
      "calendar": {
        "name": "Google Calendar",
        "role_in_flow": "processor",
        "region": "global",
        "safeguards": "OAuth 2.0 scoped read/write",
        "dpa_signed": true,
        "dpa_ref": "DPA-GOOGLE-REF"
      },
      "analytics": {
        "name": "PostHog",
        "role_in_flow": "processor",
        "region": "eu-central-1",
        "safeguards": "IP anonymization enabled",
        "dpa_signed": true,
        "dpa_ref": "DPA-POSTHOG-REF"
      },
      "payment_provider": {
        "name": "Moyasar",
        "role_in_flow": "processor",
        "region": "sa-central-1",
        "safeguards": "PCI-DSS Level 1; CVV/PAN never stored",
        "dpa_signed": true,
        "dpa_ref": "DPA-MOYASAR-REF"
      }
    },
    "region": "us-west-1",
    "retention_days": 1095,
    "retention_trigger": "last_interaction",
    "deletion_method": "anonymize",
    "consent_capture": {
      "required": true,
      "method": "explicit_checkbox",
      "timestamp_field": "consent_timestamp",
      "evidence_ref": "consent_record_id"
    },
    "data_subject_path": {
      "access": "POST /api/v1/data-subject/access",
      "rectification": "POST /api/v1/data-subject/rectify",
      "deletion": "POST /api/v1/data-subject/delete",
      "portability": "GET /api/v1/data-subject/export"
    },
    "cross_border_transfer": {
      "occurs": true,
      "mechanism": "standard_contractual_clauses",
      "safeguards": "SCCs signed; counsel review pending",
      "counsel_review_ref": "PENDING-COUNSEL-REVIEW"
    },
    "review_status": "draft",
    "notes": "Tenant isolation via row-level security; approval-gated writes."
  },
  {
    "flow_id": "DF-MSG-001",
    "category": "message_content",
    "controller_role": "controller",
    "purpose": "Inbound/outbound email and support message content for service delivery",
    "lawful_basis": "legitimate_interest",
    "source": {
      "system": "internal",
      "method": "derived"
    },
    "fields": [
      "subject",
      "body_excerpt",
      "channel",
      "direction"
    ],
    "recipients": [
      {
        "name": "Railway PostgreSQL",
        "role": "processor",
        "region": "us-west-1",
        "safeguards": "Tenant-scoped RLS; soft-delete honored"
      }
    ],
    "processors": {
      "railway_postgres": {
        "name": "Railway Inc.",
        "role_in_flow": "processor",
        "region": "us-west-1",
        "safeguards": "Postgres with row-level security, tenant_id enforced",
        "dpa_signed": true,
        "dpa_ref": "DPA-RAILWAY-REF"
      },
      "vercel_hosting": {
        "name": "Vercel Inc.",
        "role_in_flow": "processor",
        "region": "us-east-1",
        "safeguards": "Edge caching disabled for authenticated routes",
        "dpa_signed": true,
        "dpa_ref": "DPA-VERCEL-REF"
      },
      "llm_providers": [
        {
          "name": "OpenAI",
          "role_in_flow": "sub_processor",
          "region": "us-east-1",
          "safeguards": "Zero retention on API tier, no training on inputs",
          "dpa_signed": true,
          "dpa_ref": "DPA-OPENAI-REF"
        }
      ],
      "email_service": {
        "name": "Resend",
        "role_in_flow": "processor",
        "region": "us-east-1",
        "safeguards": "DKIM/SPF configured, unsubscribe enforced",
        "dpa_signed": true,
        "dpa_ref": "DPA-RESEND-REF"
      },
      "whatsapp_bsp": {
        "name": "Meta WhatsApp Business",
        "role_in_flow": "processor",
        "region": "multi-region",
        "safeguards": "WhatsApp Business Policy; no automation, opt-in only",
        "dpa_signed": false,
        "dpa_ref": "PENDING-META-DPA"
      },
      "calendar": {
        "name": "Google Calendar",
        "role_in_flow": "processor",
        "region": "global",
        "safeguards": "OAuth 2.0 scoped read/write",
        "dpa_signed": true,
        "dpa_ref": "DPA-GOOGLE-REF"
      },
      "analytics": {
        "name": "PostHog",
        "role_in_flow": "processor",
        "region": "eu-central-1",
        "safeguards": "IP anonymization enabled",
        "dpa_signed": true,
        "dpa_ref": "DPA-POSTHOG-REF"
      },